Game Title,Genre,Sub-Genre,Key Mechanics,Key Dynamics,Key Aesthetics,Misc Game Characteristics,PEGI Rating,Gameplay Summary,Major Game Design Elements,Developer,Publisher
Dota 2,RTS,MOBA,Hero selection and role-based play; Lane pushing and defense; Team Fights; Strategic item usage; Map control,"High teamwork and communication; Strategy-driven roles like support, carry, or tank; Dynamic skill-based combat; Resource management; Objective-based dynamics","Immersive, visually distinctive hero designs and animations; Vast range of skins and cosmetics; Spectator-friendly UI; Esports-oriented presentation",Regular gameplay patches with new features; In-game events and seasonal content; Active Esports and tournament scene,PEGI 12,"A complex, team-based multiplayer game where two teams of five players each select unique heroes to fight in lanes, push objectives, and ultimately destroy the opponent's base. Each match provides unique challenges and strategies.",Multi-layered gameplay with a mix of real-time strategy and RPG elements; Role-based team composition and strategy; Esports integration and regular tournaments; In-game achievements and matchmaking system,Valve Corporation,Valve Corporation
Fortnite,Action-Adventure,Battle Royale,Third-person shooting; Building and crafting; Resource gathering; Multiplayer combat; Weapon customization,Survival until the last player; Team coordination in squads; Environmental exploration; Continuous strategic planning based on terrain and resources,"Bright, cartoonish art style; Vibrant landscapes with contrasting color themes; Mix of realistic and exaggerated character designs; Dynamic music that adapts to in-game events; Frequent seasonal and thematic changes",Offers both Battle Royale and Creative modes for building and sharing custom content using Unreal Engine editor.,PEGI 12,"Players compete to be the last one standing in a shrinking play zone while using various weapons, building structures, and deploying tactics to outmaneuver enemies. Fortnite also includes non-combat Creative modes where players can create and share their own levels and game experiences.","Focus on player expression and creativity; engaging players through seasonal updates, cosmetics, and the evolving game map; Community engagement is high due to the developer tools available for custom content creation and in-game events",Epic Games,Epic Games
League of Legends,MOBA,Strategy; RPG,"5v5 Team-Based Combat; Players control unique champions and engage in fast-paced, team-based strategy on a three-lane map; Abilities & Power Scaling; Lane Farming and Objectives; Teams assign roles (Top, Mid, Jungle, Bot ADC, Support) based on map position and function; Summoner Spells and Items","Team Coordination and Synergy; Requires knowledge of map control, warding, and game timing (e.g., dragon and baron respawns); Players who perform well can gain a significant advantage that helps secure victory if properly utilized; In-game communication; Matchmaking and Ranked System",Fantasy Worlds; Character Design; Iconic Map (Summoner's Rift); Visual Feedback; Lore-rich Universe,"One of the most popular esports games globally, with an extensive competitive scene and annual World Championships.",PEGI 12,League of Legends is a fast-paced MOBA where two teams of five fight to destroy each other’s Nexus while defending their own. Players choose unique champions with varying abilities and must work together to capture objectives and overpower the opposing team.,Champions' abilities; team roles; strategic depth; real-time combat; ranked system,Riot Games,Riot Games
Call of Duty: Warzone,FPS,Battle Royale,Massive Multiplayer Battle Royale on a shrinkage map; Looting System; Contracts; Players can complete side missions like scavenger hunts and bounties to earn in-game currency; Respawn Mechanic (Gulag) where eliminated players get a second chance to return to the game by winning a 1v1 battle in the Gulag; Team-based or Solo Play,Player Elimination; Shrinking Play Area; Survival & Strategy; High-stakes Combat; Randomized Spawns where the random placement of weapons and equipment adds an element of unpredictability,Realistic Military Setting; Modern Weapons & Vehicles; Cinematic Effects; Immersive Sound Design; War-torn Landscapes,"Includes cross-play across platforms, allowing PC, PlayStation, and Xbox players to play together.",PEGI 18,"Call of Duty: Warzone is a free-to-play battle royale game where players drop into Verdansk and fight to be the last squad standing. Players can find weapons, complete contracts for in-game cash, and revive fallen teammates through various mechanics.",Battle Royale; realistic combat; team-based play; resource management; map shrinkage,"Infinity Ward, Raven Software",Activision
Minecraft,Adventure,Creative; Survival; Sandbox adventure,"Resource Gathering; Crafting & Building: procedurally generated world encourages players to explore varied biomes, caves, and dungeons; In survival mode, players must manage health, hunger, and combat hostile creatures; Complex engineering using redstone (a power source) allows players to create intricate contraptions and automated systems","Open-ended gameplay where players set their own objectives, from building monuments to defeating the Ender Dragon; Players can express creativity by designing and building vast structures; Players must manage resources and defend against creatures like zombies, skeletons, and creepers; Minecraft offers multiplayer modes where players can collaborate or compete in building or survival challenges; Special maps and custom worlds allow for puzzle-solving and adventure storytelling",Block-Based Art Style; Pixelated Graphics; Wide Open Landscapes; Day/Night Cycle; Endless Creation,"Extensive modding community that extends the base game with new features, textures, and gameplay modes.",PEGI 7,"Minecraft is an open-world sandbox game where players can explore a procedurally generated world, mine resources, craft tools, and build structures. Players can engage in either survival mode, managing health and hunger, or creative mode, with unlimited resources to build.",Open-world sandbox; crafting; resource management; exploration; modding,Mojang,Mojang / Xbox Game Studios
Call of Duty: Modern Warfare,FPS,Military Shooter,"Realistic Gunplay; A gripping, narrative-driven campaign with missions set in various real-world locations; Various multiplayer modes such as team deathmatch, domination, and ground war; Players are rewarded with killstreaks like airstrikes and UAVs after consecutive kills; Players can personalize weapons, attachments, perks, and killstreaks to fit their combat style",Tactical Shooting; Team Play; Killstreak Tension: High-Stakes Combat; Campaign Drama,Photorealistic Graphics; Military Authenticity; Dynamic Lighting; Gripping Sound Design; Cinematic Storytelling,"Includes cross-platform play and progression, enabling PC, PlayStation, and Xbox users to play together",PEGI 18,"Call of Duty: Modern Warfare is a fast-paced FPS that offers both an engaging, narrative-driven single-player campaign and various multiplayer modes. Players fight in realistic, tactical environments with a large array of weapons and equipment.",Tactical combat; realistic shooting mechanics; cinematic storytelling; multiplayer team dynamics,Infinity Ward,Activision
Call of Duty: Black Ops,FPS ,Military Shooter; Espionage,"First-Person Combat where Fast-paced, realistic military shooting mechanics set during the Cold War era; Campaign mode; Variety of competitive modes, including capture the flag, domination, and team deathmatch; Zombies Mode where a cooperative mode where players fend off waves of zombies while managing resources and upgrading weapons; Players can customize loadouts, perks, and killstreak rewards to suit their playstyle",Covert Espionage; Zombie Survival; Competitive Multiplayer; Killstreak System adds tension by rewarding players for getting consecutive kills without dying; High Replay Value,"Cold War Atmosphere; Historical Settings; Cinematic Storytelling; Grim, Dark Tone; Detailed Weaponry","Popular Zombies mode, which later became a staple of the Black Ops series, offering a unique co-op experience",PEGI 18,"Call of Duty: Black Ops features a gripping Cold War-era campaign, fast-paced multiplayer modes, and a cooperative Zombies mode. The game emphasizes covert operations and tactical shooting, offering a mix of stealth and direct combat.",Covert operations; multiplayer modes; Zombies survival; narrative-driven campaign,Treyarch,Activision
Pokemon Go,Adventure,Augmented Reality; Geolocation-based Game,Geolocation: Players use real-world locations to find and catch Pokémon; AR: Pokémon appear in real-world environments; PokéStops and Gyms: Locations for items and battles; Catch and Collect: Complete Pokédex; In-game Events: Exclusive Pokémon and bonuses.,"Exploration: Encourages travel to find different Pokémon; Community Engagement: Raids and battles require teamwork; Resource Management: Manage Poké Balls, potions, etc; Progression: Level up by capturing and evolving Pokémon; Fitness Integration: Promotes walking to hatch eggs.",Cartoony Art Style: Pokémon are bright and colorful; Real-World Environment: AR shows Pokémon in real-world settings; Minimalist Interface: Clean UI for easy interaction; Dynamic Audio: Sound effects and iconic Pokémon cries increase immersion.,Cross-generational Appeal: Loved by both old and new Pokémon fans; Social Play: In-game events encourage interaction; Fitness Integration: Syncs with fitness apps; Frequent Updates: Constantly updated with new events and Pokémon.,PEGI 7,"Pokémon Go is an AR game where players catch Pokémon in real-world locations using their smartphones. They explore to visit PokéStops and Gyms, battle in raids, and complete in-game events, all while walking to unlock rewards.",AR mechanics; geolocation-based gameplay; resource management; social play,"Niantic, Inc","Niantic, Inc., The Pokémon Company"
The King's Request: Physiology and Anatomy Revision Game,Serious Games,Educational; Quiz,Players answer questions on anatomy and physiology; Multiple-choice Mechanics; Progression-based Learning; Time-based Challenges; Score Tracking for self-evaluation,"Engages players in learning medical concepts while gaming; Builds mastery through repetition of quizzes; Difficulty increases as the player progresses; Instant feedback on wrong answers, fostering learning","Simple Visuals emphasizes function over form, with basic graphics; Educational Sound Effects adds cues for correct/incorrect answers; Medical Environment Themed around medieval fantasy with anatomy content; Simple UI focused on quizzes and content",Designed for Students; Fantasy-Style Setting with Unique medieval theme makes anatomy learning more engaging; Regular updates ensure accurate content; Immediate feedback enhances learning,NA,The King's Request is an educational game that tests players on their knowledge of anatomy and physiology through interactive quizzes. It’s set in a medieval fantasy world where players must answer progressively harder questions to help the king’s kingdom survive.,Quiz-based mechanics; educational gameplay; immediate feedback; progression-based difficulty,Physiology with Dr Christian,Physiology with Dr Christian
The Sims 4,Simulation,Life Simulation; Casual game; Strategy game,Players can customize their characters (Sims) with extensive physical and personality options; Create and design homes and lots; Live Mode where players Control Sims’ daily activities and interactions; Sims react based on their emotions; Expansion Packs to add new content regularly added to expand gameplay.,"Players create their own stories through Sims’ actions; Resource Management to manage needs like hunger, sleep, and socializing; Relationship Building; Under autonomy, Sims act independently unless directed","Colorful, playful art style reflecting life simulation; Light music and ambient sounds, depending on Sim actions; Varied and highly customizable house and lot designs; Realistic yet exaggerated Sim animations add humor","Frequent updates and expansion packs with new features; Strong community modding; In Sandbox Mode there are no win conditions, focused on creativity and storytelling; Emotional Complexity for gameplay",PEGI 12,"The Sims 4 is a life simulation game where players create and control characters (Sims), managing their everyday activities, relationships, and homes. Players build homes, guide careers, and create stories in an open-world setting. Expansion packs add depth.",Life simulation mechanics; emergent gameplay; resource and relationship management," Maxis, The Sims Studio",Electronic Arts
Splatoon 3,Action,Third-Person Shooter,"Ink-based Combat where Players shoot ink to cover territory or splat enemies; Switch between human and squid forms; Weapon Variety like ink shooters, rollers, and splat bombs; Turf War Mode where Teams compete to cover the most area with their ink; Focus on 4v4 online matches with various modes;",Territorial Control where the game revolves around covering the most ground with your team’s ink; Fast-Paced Combat; Team Strategy requires Cooperation to win battles; Splats vs. Survival to facilitate Balancing offense (splatting enemies) and defense (covering turf).,"Vibrant, Cartoonish Visuals; Dynamic Soundtrack; Fluid movement between human and squid forms adds charm; Unique Urban-Fantasy Setting",Customizable Gear where Players can equip clothing that influences gameplay; Unique Squid Form Mechanic lets players swim through their ink for faster movement; Frequent Updates; Single-player Campaign offers more structured gameplay alongside multiplayer.,PEGI 7,"Splatoon 3 is a fast-paced third-person shooter where players control ink-based weapons to cover territory and defeat opponents. The game features a vibrant world and emphasizes multiplayer matches, with unique squid transformation mechanics.",Ink-based combat mechanics; focus on territorial control; fast-paced multiplayer; vibrant visual design.,Nintendo EPD,Nintendo
Rail Maze : Train puzzler,Puzzle,Maze/Logic,Track Building where plqayers can create and modify rail tracks to guide trains; Obstacle Avoidance to avoid collisions and obstacles like dynamite; Switching Tracks to redirect trains; Timed Puzzles; Train Path Optimization,Problem Solving where players should show quick thinking to avoid train crashes; Sequential Thinking; Challenge Progression; Pacing where players can take their time in some levels while others are more time-sensitive,Cartoonish Graphics; Train-Themed Aesthetic; Simple UI; Dynamic Obstacles,Multiple Game Modes like Labyrinth and Build-a-Labyrinth; Casual Play making it Accessible for players of all ages; Mobile-Friendly; User-Created Content where players can design their own mazes.,PEGI 3,Rail Maze is a logic-based puzzle game where players build and adjust train tracks to guide trains through obstacles and avoid collisions. The game offers progressively more difficult challenges and multiple game modes.,Puzzle-solving based on track design; train management; obstacle avoidance,Spooky House Studios,Spooky House Studios
Space Invaders,Action,Shoot 'em up,Shooting Mechanics: Player controls a cannon to shoot alien invaders; Enemy Waves; Limited shields protect the player; Increasing Speed of aliens as fewer remain; Single Life Mechanic with Limited lives per game,Risk vs. Reward where Players must balance between taking shots and using cover; Progressive Difficulty; High Score Chasing; The game ends when all lives are lost,Classic Retro Graphics;. Monochromatic Display; Arcade Sounds; Simplistic UI,Iconic Gameplay; Arcade Classic that popularized arcade gaming; Endless Mode; Single-Player Focus,PEGI 7,Space Invaders is a classic arcade game where players defend Earth from waves of descending alien invaders by shooting them down with a laser cannon. The game progressively increases in difficulty and challenges players to beat high scores.,Iconic shoot 'em up mechanics with progressive difficulty; simple but addictive gameplay,Taito,Taito
Edge,Puzzle,Platform Puzzle,Cube Control where Players move a cube through different levels; Precision Movement required for navigating narrow pathways and edges; Momentum Physics; Platforming Challenges: Navigate between platforms and avoid obstacles; Minimalistic movement mechanics.,Discover hidden paths and shortcuts; Timed Levels; Gradually increasing Difficulty as you progress; Risk and Reward for fast movement,Minimalistic Graphics; Retro-Futuristic Soundtrack; Neon Lighting; Geometric Aesthetics,Mobile Compatibility; Touch Controls; Compact Level Design; Focused purely on puzzle-solving; Does not involve any combat,PEGI 3,"Edge is a minimalist platform-puzzle game where players control a cube and navigate it through complex geometric levels, using momentum and precision to avoid falling and complete challenges.",Puzzle-solving through precise movements and momentum-based mechanics.,Mobigame,Two Tribes Publishing
Unpossible,Action,Endless Runner,Speed-Based Control to navigate a futuristic pathway while avoiding obstacles; Touch/Accelerometer Controls with simple swipe or tilt inputs; Levels become increasingly difficult and randomized; Requires fast reactions and quick reflexes to survive; Leaderboards,Increasing Difficulty; Survival Mechanics where players must avoid crashing to keep playing; Replayability; Short Play Sessions designed for quick but intense gameplay sessions,Futuristic Setting; Minimalistic Art; Dynamic Camera Angles provide intense visual feedback when navigating at high speeds; Sci-fi Soundtrack,Cross-Platform; Easy-to-learn but hard-to-master mechanics; Short Bursts of Gameplay which is ideal for quick gaming sessions.,PEGI 3,"Unpossible is an endless runner where players guide a vessel through an ever-changing futuristic track, avoiding obstacles while progressively increasing their speed and reflexes to survive.",Reflex-based endless runner with randomized challenges and fast-paced action,Acceleroto,Acceleroto
L.A. Noire,Action-Adventure,Detective/Crime,"Interrogation Mechanics where players solve cases by questioning witnesses and suspects; Explore crime scenes for clues; Includes Action Elements like shootouts, chases, and combat; Dialogue Choices: Branching dialogue impacts case outcomes; Open World where player has to explore a large, detailed version of 1940s Los Angeles",Narrative-Driven; Moral Decision-Making where players can affect the course of investigations based on how they interrogate suspects; Immersive Atmosphere includes realistic city with authentic period details; Slow-Paced Action as it mixes slower detective work with bursts of action.,"Film Noir Aesthetic with black-and-white, moody atmosphere reminiscent of 1940s detective films; Authentic 1940s Setting with period-specific cars, buildings, and fashion; Facial Animation Tech: Revolutionary MotionScan technology for lifelike expressions; Cinematic Presentation","Realistic Crime Solving where cases are based on real historical crimes; Unique Blend of Genres like investigation, open-world, and action-adventure; MotionScan Tech; First game to use revolutionary facial animation tech",PEGI 18,"L.A. Noire is an open-world detective game set in 1940s Los Angeles, where players solve crimes through interrogation, investigation, and action sequences, all while navigating moral dilemmas.","Immersive, narrative-driven detective gameplay with period-accurate open-world exploration",Team Bondi,Rockstar Games
Need for Speed: Carbon,Racing,Street Racing,"Drift Mechanics in canyon races; Crew System where players form a team with different abilities (blockers, drafters, scouts); Car Customization like Deep tuning and visual customization of vehicles; Canyon Duels include Intense 1v1 downhill races; Police Pursuits where players evade law enforcement while racing",High-Speed Racing with tight turns; Team-Based Racing where players work with AI teammates in races; Higher risks in canyon duels lead to greater rewards; Free-roam Exploration across an open city at night,Nighttime Setting; Neon Aesthetic; Features a cinematic and dramatic storyline about rival crews; Realistic Car Models with licensed vehicles and attention to detail in design.,Unique canyon duels that push players' driving skills to the limit; Focus on Drifting emphasizes on drift-heavy racing; First game to introduce a team-based racing dynamic; Continuation of Storyline makes it a direct sequel to Need for Speed: Most Wanted giving closure to players.,PEGI 12,"Need for Speed: Carbon is a street racing game focused on drift mechanics, team-based races, and high-stakes canyon duels, with police pursuits and deep car customization in an open-world environment.","High-octane street racing with an emphasis on drifting, teamwork, and customization.",EA Black Box,Electronic Arts
Mountain Goat Mountain,Platformer,Endless Climber,"Simple tap to move mechanics; Vertical Climbing where players must scale a mountain while avoiding obstacles; Randomly Generated Terrain where no two climbs are the same; Hazards and Obstacles like falling rocks, rivers, and other challenges; Different Unlockable Goats with unique traits.	","Score-Based; Replayability with Endless gameplay with new challenges each run; Quick, Arcade Sessions; Risk and Reward for balancing between fast climbing and avoiding hazards.","Colorful, Cartoonish Graphics; Cute Character Design for Goats with humorous, unique appearances; Whimsical Soundtrack; Vibrant Mountain Settings with diverse environments like grassy, icy, and desert areas",Collecting different goats offers varied playstyles; Mobile Optimized; Casual Fun,PEGI 3,"Mountain Goat Mountain is a casual endless platformer where players guide goats up perilous mountains, avoiding hazards while collecting points and unlocking new characters.",Quick arcade-style platformer with colorful aesthetics and endlessly replayable gameplay,Zynga,Zynga
America's Army: Proving Grounds,FPS,Military Simulation,"Emphasis on teamwork and real military tactics; Team-Based Combat; Cooperative gameplay where strategy and communication are key; Class System where players choose different roles (medics, riflemen, etc.); Objective-Based Missions; Realistic Weaponry like Authentic firearms and gear","Tactical Combat which encourages slow, methodical gameplay; Teamwork; Risk Management for Decision-making between completing objectives and protecting team members; Challenging Missions",Realistic Graphics with Authentic military settings and weapon models; Authentic Sound Design; Serious Military Tone as it was designed as a recruitment tool for the U.S. Army; Immersive Environments with detailed battlegrounds based on real military operations.,Free-to-Play; Military Simulation; Educational and provides insight into real military strategies and teamwork.,PEGI 16,"America's Army: Proving Grounds is a tactical military shooter designed to simulate real-world military operations, focusing on team-based combat, strategy, and completing objectives.","Tactical military simulation with an emphasis on realism, teamwork, and authentic military scenarios",U.S. Army,U.S. Army
Sneak King,Action,Stealth,Stealth Mechanics where players sneak up on unsuspecting people to deliver food; Surprise Element where Players are rewarded for surprising NPCs with food; Simple Controls; Mission-Based gameplay with different challenges in various levels; Timer-Based Gameplay,Stealth-Based Challenges;  Humor Dynamics with Light-hearted gameplay based on the absurd premise of surprising NPCs with food; Quick Progression; Risk and Reward,"Quirky, Humorous Style; Cartoonish Visuals; Bright, Playful Color Palette; Fast-Paced Music",Marketing Tie-In where it was promoted as part of Burger King's ad campaign; Limited Release; Humorous Concept of Delivering food stealthily,PEGI 3,"Sneak King is a quirky stealth-action game where the player, as the Burger King, sneaks around to deliver fast food to unsuspecting people in different levels.",Unique stealth mechanics combined with a marketing concept; Humorous and light-hearted stealth-action game,Blitz Arcade,King Games
Tom Clancy's Rainbow Six: Vegas 2,FPS,Tactical Shooter,Tactical Shooter Mechanics with a strategy-focused team-based shooter; Use cover and stealth to gain the upper hand; Squad-Based Gameplay where players Issue orders to AI-controlled teammates; Realistic Weaponry; Cooperative and competitive multiplayer modes.,"Squad Management; Pacing and Strategy that encourages methodical, slower-paced gameplay rather than run-and-gun; Risk and Reward for careful planning and positioning determine success; Multiplayer Competitiveness with highly tactical multiplayer modes, focusing on team coordination.","Realistic Visuals with True-to-life depictions of weapons, characters, and environments; Authentic City Environments of game set in Las Vegas with detailed urban locales; Tactical Serious Military Aesthetic; Tension-Building Soundtrack",Sequel to Rainbow Six Vegas; Extensive Multiplayer Modes; Tactical Depth as it is one of the most strategic shooters available,PEGI 16,"Tom Clancy's Rainbow Six: Vegas 2 is a tactical shooter that combines team-based, strategy-focused gameplay with realistic firearms and immersive urban environments.","Tactical, squad-based shooter with a mix of strategic planning and intense action sequences",Ubisoft Montreal,Ubisoft
